,title,description,published_at,url
79,Reality Check,"I'm sick and god-damn tired of this! I have written tens of thousands of words about this and still, to this day, people are babbling about the ""AI revolution"" as the sky rains blood and crevices open in the Earth, dragging houses and cars and domesticated an…",2025-04-28T16:53:36Z,https://www.wheresyoured.at/reality-check/
80,JSX over the Wire,Turning your API inside-out.,2025-04-15T15:56:18Z,https://overreacted.io/jsx-over-the-wire/
81,"People Who've Worked For The Ultra-Wealthy Are Airing Out Alllllllll Their Dirty Laundry, And My Mouth Is Hanging Open","""He bought a $2 million plane on a whim one weekend because he was bored.""View Entire Post ›",2025-05-03T23:16:02Z,https://www.buzzfeed.com/hannahdobro/shocking-confessions-from-staff-of-super-rich
82,Announcing Android support of digital credentials,"Android supports the DigitalCredential API, enabling users to select credentials directly and developers to become verifiers or digital app providers.",2025-04-30T16:00:00Z,https://android-developers.googleblog.com/2025/04/announcing-android-support-of-digital-credentials.html
83,"Erster Gegner der FTC unter Trump: Klage gegen Uber wegen Abodienst ""Uber One""","Für 10 US-Dollar im Monat gibt es bei ""Uber One"" Nachlässe. Weil das Versprechen überzogen und die Kündigung zu schwierig sei, klagt die US-Handelsaufsicht.",2025-04-22T04:59:00Z,https://www.heise.de/news/Erster-Gegner-der-FTC-unter-Trump-Klage-gegen-Uber-wegen-Abodienst-Uber-One-10357546.html
84,Autonomes Fahren: Uber kooperiert bei Robotaxis mit Momenta aus China,"Uber arbeitet mit dem Startup Momenta zusammen, um Robotaxi-Dienste außerhalb der USA und Chinas einzuführen. In Europa sollen die Fahrzeuge von 2026 an rollen.",2025-05-04T16:16:00Z,https://www.heise.de/news/Autonomes-Fahren-Uber-kooperiert-bei-Robotaxis-mit-Momenta-aus-China-10370961.html
85,Google Cloud Next 2025: Blick zurück auf Alphabets größte Konferenz,"Vertex AI aufgemotzt, Ironwood-TPU, Agenten-SDK und Cloud WAN für Firmen: Das sind nur einige der Highlights vom Google-Cloud-Event. Ein Rückblick.",2025-04-28T08:40:00Z,https://www.heise.de/hintergrund/Google-Cloud-Next-2025-Blick-zurueck-auf-Alphabets-groesste-Konferenz-10361723.html?wt_mc=rss.red.ho.ho.atom.beitrag.beitrag
86,"Beyond Cupertino: Uber’s 32-step cancellation process, Bluesky blue checks, and more","Tech companies have often been accused of making it hard to cancel subscriptions, but Uber appears to have taken things to a whole new level! It’s being sued by the FTC for forcing Uber One subscribers to take as many as 32 separate actions when they want to …",2025-04-22T11:50:22Z,https://9to5mac.com/2025/04/22/beyond-cupertino-ubers-32-step-cancellation-process-bluesky-blue-checks-and-more/
87,Google Wallet's digital IDs are expanding to more US states,Google Wallet is rolling out digital ID support to four more states,2025-04-29T18:04:41Z,https://www.androidpolice.com/google-wallets-digital-ids-are-expanding-to-more-us-states/
88,6 privacy settings you need to check on your Android phone right away,Check and change these settings without fail.,2025-05-04T15:25:10Z,https://www.androidpolice.com/privacy-settings-every-android-user-should-check/
89,"Lyft, el principal rival de Uber, da el salto a Europa comprando FreeNow por 175 millones de euros","La plataforma de movilidad estadounidense Lyft, principal rival en aquellos lares de Uber, ha anunciado su desembarco en Europa mediante la adquisición de FreeNow, una de las aplicaciones de transporte más consolidadas del continente, por un total de 175 mill…",2025-04-16T13:36:23Z,https://www.genbeta.com/actualidad/lyft-principal-rival-uber-da-salto-a-europa-comprando-freenow-175-millones-euros
90,Consumo investigará a las VTC como Uber y Cabify por posibles subidas de precio de hasta el 300% durante el gran apagón,"El pasado 28 de abril, España vivió un gran apagón que generó una fuerte situación de alarma e incertidumbre. En este tipo de escenarios, algunas empresas pueden aprovecharse del contexto para aplicar subidas de precio en bienes o servicios esenciales. Ahora,…",2025-04-30T12:48:49Z,https://www.genbeta.com/actualidad/consumo-investigara-a-vtc-como-uber-cabify-posibles-subidas-precio-300-durante-gran-apagon
91,"""No sabía que teníais una siesta de Internet"". Fuera de España han descubierto los bloqueos de LaLiga y flipan (para mal)","Lo que parecía una medida más contra la difusión no autorizada de eventos deportivos se está convirtiendo en una de las polémicas tecnológicas del año en España... una que cada vez encuentra más eco fuera de nuestras fronteras, dado que no deja de afectar cad…",2025-04-16T16:29:38Z,https://www.genbeta.com/actualidad/no-sabia-que-teniais-siesta-internet-fuera-espana-han-descubierto-bloqueos-laliga-flipan-para-mal
92,"How Rich Barton Built Expedia and Zillow from $0 to $35B — Audacious Goals, Provocation Marketing, Scrabble for Naming, and Powerful Daily Rituals (#806)","Rich Barton, Co-Founder of Zillow, Expedia, and Glassdoor, on The Tim Ferriss Show podcast! 
The post How Rich Barton Built Expedia and Zillow from $0 to $35B — Audacious Goals, Provocation Marketing, Scrabble for Naming, and Powerful Daily Rituals (#806) app…",2025-04-17T16:46:36Z,https://tim.blog/2025/04/17/rich-barton/
93,Black-market groups on Facebook are reportedly selling Uber and DoorDash accounts that let people bypass background checks and driver’s license provisions,"Users buy and rent Uber driver accounts, raising safety concerns.",2025-04-15T14:31:26Z,https://www.yahoo.com/news/black-market-groups-facebook-reportedly-143126404.html
94,"Chicken, crypto and Nvidia: The companies that helped Trump’s inauguration shatter fundraising records","A wide array of companies helped President Trump shatter fundraising records during his second inauguration, netting $239 million.",2025-04-21T16:09:42Z,https://finance.yahoo.com/news/chicken-crypto-and-nvidia-the-companies-that-helped-trumps-inauguration-shatter-fundraising-records-160942136.html
95,"Smaller planes, big questions: Why regional airlines are under the spotlight","Regional airlines are a major, but sometimes hidden, part of the aviation system in the U.S. Here's how they operate with major carriers.",2025-04-07T09:01:49Z,https://www.usatoday.com/story/travel/airline-news/2025/04/07/what-is-a-regional-airline/80065016007/
96,Inside the App Store: getting the most from Apple's app marketplaces,"Apple's App Store has been around for 17 years, and there's a rich history and a wealth of apps to discover. Here's what you need to know, and how to get started with it.Image Credit: AppleWhile the iPhone first hit the market in June 2007, the iOS App Store …",2025-05-02T12:37:56Z,https://appleinsider.com/articles/25/05/02/inside-the-app-store-getting-the-most-from-apples-app-marketplaces
